<?xml version="1.0"?>
<!--
Click nbfs://nbhost/SystemFileSystem/Templates/Licenses/license-default.txt to change this license
Click nbfs://nbhost/SystemFileSystem/Templates/XML/XmlSchema.xsd to edit this template
-->

<xs:schema version="1.0" xmlns:xs="http://www.w3.org/2001/XMLSchema" elementFormDefault="qualified">
    <xs:element name="history">
        <xs:complexType>
            <xs:sequence>
                <xs:element name="descripcion" maxOccurs="unbounded">
                    <xs:complexType>
                        <xs:sequence>
                            <xs:element name="name"/>
                            <xs:element name="fecha">
                                <xs:complexType>
                                    <xs:sequence>
                                        <xs:element name="dia"/>
                                        <xs:element name="mes"/>
                                        <xs:element name="aÃ±o"/>
                                    </xs:sequence>
                                </xs:complexType>
                            </xs:element>
                        </xs:sequence>
                    </xs:complexType>
                </xs:element>
            </xs:sequence>
        </xs:complexType>
    </xs:element>
</xs:schema>
