<?xml version="1.0" encoding="UTF-8"?>
<!--
<!DOCTYPE history[
    <!ELEMENT history (descripcion*)>
    <!ELEMENT descripcion (name,fecha)>
    <!ELEMENT name (#PCDATA)>
    <!ELEMENT fecha (dia,mes,año)>
    <!ELEMENT dia (#PCDATA)>
    <!ELEMENT mes (#PCDATA)>
    <!ELEMENT año (#PCDATA)>
    
]>
-->
<history xmlns:xsi='http://www.w3.org/2001/XMLSchema-instance' xsi:noNamespaceSchemaLocation='schema03.xsd'>
    <descripcion>
        <name>Youtube</name>
        <fecha>
            <dia>15</dia>
            <mes>2</mes>
            <año>2005</año>
        </fecha>
    </descripcion>
    <descripcion>
        <name>Google</name>
        <fecha>
            <dia>4</dia>
            <mes>9</mes>
            <año>1998</año>
        </fecha>
    </descripcion>
    <descripcion>
        <name>facebook</name>
        <fecha>
            <dia>4</dia>
            <mes>2</mes>
            <año>2004</año>
        </fecha>
    </descripcion>  
</history>
